Text,Emotion
started day feeling pretty discouraged im going bed hopeful,angry
started develop feelings scared freaked promised safe,neutral
started feel gentle steady pull encouragement,angry
started feel angry,angry
started feel apprehensive,neutral
started feel content well intentioned person would tell keeping happy like,happy
started feel helpless angry time something read,angry
started feel helpless angry time something read,angry
started feel super emotional time strange,neutral
stayed numb possible since honestly right feel erics time blindingly enraged,angry
stayed crying long time feeling sad probably always miss see feeling happy loved ones,sad
stepped house makes feel depressed,sad
still cant help feel appalled depressed though,sad
still didnt even know feel got truly fabulous email friend w ways wanted encourage thirties rather let stay state nervousness insecurity,angry
still feel bit discouraged,angry
still feel angry href http finsterfinds,angry
still feel angry angry specifically person committed acts also feel like attack personal level,angry
still feel angry think went clinic session,angry
still feel angry sometimes wondering,angry
still feel annoyed older sd always sick something mean always,neutral
still feel times drowning water trying keep cute ornery year old comfortable happy family,happy
still feel contented peace despite kind circumstances im facing,happy
still feel contented try,happy
still feel incredibly frustrated,neutral
still feel little shaky times move slightly odd jades hair particular seems prone generally works well spencers writing,neutral
still feel like get walked well trying,neutral
still feel like somehow one family members horribly wronged tragic events transpired today,neutral
still feel outraged,angry
still feel quite discouraged though,angry
still feel restless angry time time mostly situational,angry
still feel sad like made wrong decision,sad
still feel sad sometimes,sad
still feel sadness funny dont even know feel like losing one sister,sad
still feel somewhat dissatisfied,neutral
still feel stressed,neutral
still feel expect pieces world im afraid come close place expectations upon fear hell disappoint,neutral
still feel discontent pushing chest threatening fill ducts eyes casting dark shadow demeanor,happy
still feel totally discontent,happy
still feel uncertain many new paths must travel lost feel sometimes sure heavenly father lifting helping feel joy things matter,happy
still feel unhappy perks rated nc,happy
still feel grossed bitchy guilty angry,angry
still feel vulnerable hurt manageable,neutral
still get feeling ecstatic joy,happy
still odd thing say stay come time longer feel need pound content may well time break ol shotgun put good,happy
still remember feeling melancholy old things,sad
still sometimes feel helpless sad face pain weathered short life,sad
still wake every morning feeling blessed unable believe im lucky enough able call amazing family mine life,neutral
stop long enough think im already feeling happy,happy
stop thought eating feeling fearful guilty angry bored,angry
stop thought eating feeling fearful guilty angry bored,angry
stopped feeling angry learned take,angry
stopped feeling depressed stopped feeling depressed href http thinksimplenow,sad
stopped feeling intimidated looking wod guess means learning find right balance scale push harder,neutral
stopped going weddings years back one point life know celebration would make feel somewhat depressed,sad
straight away started feel blood boil anger coming nerve getting agitated,neutral
strode feeling enraged exhilarated leaving behind wide eyed colleagues witnesses hurried forget seen,angry
stropped bit feeling grumpy missing,neutral
struggled even sharing feel ungrateful dealing discouragement midst goodness,angry
subconsciously feel little bashful display nakedness front watching maid wipe windows outside room actually shadow behind drawn curtains,neutral
suddenly feel anxious depressed,sad
suffered stroke trying quantity life forced feel fearful sad,sad
suppose moping misery feeling extremely agitated lot people,neutral
suppose millions little things causing discouraged feel depressed maybe little maybe god would want bring could help handle,sad
suppose supposed feel enraged found bit ridiculous,angry
surround bible verses help transcend space feel safe secure,neutral
suspect next evolutionary step mad rush encourage consumer feel less embarrassed would carrying groceries home,angry
tackle political ideas something makes feel angry even often personal,angry
take long sip feel cold sensation iced capp,neutral
take really hard like ill get really emo shit itll make feel depressed lose like kg days kinda thing,sad
take time wonder things gets awfully hard feel angry cynical towards,angry
take things personally feel wronged even little memories stay,neutral
talk essay people feel differently poetry angry sad,sad
talk feel happy,happy
talk otherwise communicate daily occasionally makes miss less appear dropped planet completely makes feel neurotic rejected worried angry sad like im overreacting,sad
tell let go sadness alongside feeling free,sad
tend feel zone bit beer buzz thoroughly enjoying playful banter fellow circle liners way worse wear,happy
tend feel dull sad prints colours make liven,sad
tend lose feel water pretty quickly im water every day felt race,neutral
thank students give mix handshakes high fives depart feeling contents stomach nicely shaken terribly stirred,happy
wasnt anger friend noticed ring didnt feel joyful felt sad sadness,sad
immediately feelings guilt selfish thoughts practical side appears could would take care kids parents,neutral
thereafter began feel lay readers getting something useful even maintained principal approach target tax professionals tax students content provided,happy
think today help feel little melancholy thought harry potter movies stories,sad
think single space time childhood fills immense feeling joy carefree takes breath away,happy
think throne grace gods mercy god giving things deserve feel little bit less disappointed encouraged provides help time need knowing days need help,angry
think things ive accomplished mind mine promising feel discouraged,angry
think long itching nagging anxiety starts claw chest feel depressed stifled,sad
think feelings one nay important things,neutral
think hes tired trying keep people happy feeling like respected,happy
think finally articulate prius shiny happy al gore wearing patagonia alaska way somewhat insidious makes driving feel like virtuous act,happy
think needed feel angry,angry
think remembered never bothered watch election coverage left hoping guy feeling completely helpless overly made buffoons pretend know talking,angry
think also feeling restless,neutral
think feeling touch melancholy today moving along,sad
think feeling positive little sliver abundance finances allowed reduce debt shatteringly enough make feel happy,happy
think may need next time kind bag makes feel rather melancholy,sad
think feel sad leave,sad
think try lose weight forcibly feel pressured instead maybe would better find something enjoy food,happy
think situations men right take deep breath enjoy dating experience rather feeling anxious idea impression lady friends ability open doors pay things arent,happy
think relation feeling angry bitter feelings instead soaking feelings around,angry
think combination feeling emotionally drained feeling sad general,sad
think ok feel melancholy,sad
think case whether people like anne coulter ed schultz really feel outraged viewers certainly feel kind outrage anger substance collective tirades,angry
think music great feel like always faithful music really great helps many ways life sad youre love youre mad well many ways plus music belongs heaven mean good music,sad
think taiko experience far root feeling dissatisfied somewhat unhappy lately theres something else havent able explain,happy
think feel gratitude think kind gracious heavenly father,neutral
think future subcontinent find feeling optimistic despite everything read papers,neutral
think dharavi means mumbai country keep annual turnovers aside feel agitated,neutral
think part laziness effort writing many cover letters fulfilling adult responsibilities even bigger part feeling doubtful discouraged many rejections unsure capabilities,angry
think saddam would feeling pretty tortured th episode super sweet sixteen,sad
think one good thing comes valentines day occasion lavish people gifts feel bashful always attribute hey valentines shut take gift bring shining happy face know want,happy
think tendency member majority confronted angry insulted member minority feel like unjustly blamed,angry
think pop automatically seeing pictures people makes feel insecure,neutral
think feel defeated render stuck life standstill pondering sadness unsatisfactory picking apart continuing questions get real sense hopelessness,sad
think meditation made sufficiently passive feel scared angry,angry
think movie set huge ambition something possible within budget time restraints product something left severely lacking end left feeling melancholy emotional,sad
think sooner better well feel greg im already distressed mood mom,neutral
think borders havent decided yet im happy got far feeling awful weeks,happy
think valid complaint arent willing deal aspect imagine rather subjective makes sure cover based moments still feel dangerous despite cover,neutral
think much sit voice sounds gotten food mouth feeling need make way around everyone rude,neutral
think shocked feeling hopeless lost sad helpless,sad
think dont write bottle ill feelings inside like tonight explodes angry depressing rant,angry
think ought know feeling depressed marvin said,sad
thought guilty feel enjoy less troubled church experience virginia must feel like god isnt nice hasnt called somewhere else,happy
thought depression negative thoughts ive lately intervene thoughts help feel depressed,sad
thought helped feel angry genitalia explaining stuff later used fashion girl parts,angry
thought hope vanquished england failures watching feeling envious determined everything improve maybe one day something similar die,neutral
thought might feel little sad truly thrilled cute new dress cheering loved ones friends,sad
thought really well amp buying items certain item food last week spoke friend complete one year supply amp feel really discouraged,angry
thought would possibly panic suddenly feel hopeless depressed happening,sad
thought id alwayz feel held back dissatisfied angry,angry
thought id give struggle chance hoping would enjoy bit first book came away feeling utterly disappointed finished,happy
thought little angel perfect represent sadness feel also hope protection angels always symbolize sending still suffering,sad
tired hearing unique communications special feelings sincere,neutral
accomplish without feeling discouraged,angry
told e fact matter many days times feel resentful angry resigned frustrated fact lucky enough able live life allows make use various skills,angry
told cannot continue way starting feel frustrated let know calm way,neutral
told father carry cross long bless husband heal long comfortable wherever whether washington financially find way feel successful content,happy
told friend didnt think future would need responsible survivability id probably taking courses make feel happy,happy
told friend location palace gave sad feeling cold,sad
told never wanted rot hell time wished less stupid clumsy never ever feel unhappy,happy
took couple cuttings trimmed back lanky growth hadnt filled part made feel unhappy hung window left kitchen sink,happy
took part football match referee extremely partial opposite team stirred discontent anger,happy
took time enjoy moment feel completely content moment,happy
totally know feel work area many students disadvantaged,sad
totally passed one first appeared xbla sony handheld feels like pretty perfect fit,neutral
treasure actual physical hugs kisses shared least skype dates help feel less lonely depressed near,sad
tried calm didnt want calm probably hed feel scared humiliated oh angry much powerful feeling,angry
tried hide emotions didnt want know thankful someone last called feeling someone accepted everything someone wanted hear sadness turmoil,sad
truly feel followers friends caring support meant much wanted share exquisite joy,happy
trust moments feeling fine even moments joy grief may sometimes come slam face,happy
try let ignorance get energy feels important sometimes ill engage little light debate try broaden view world,neutral
try always brave pain migraines pain find completely unbearable always feel embarrassed depressed state well end going er migraine happened twice sure maybe many four times,sad
try approach thing called nature something im feeling bit envious,neutral
try feel things time felt nothing times unhappy,happy
try feel confident ever eyes meet feel strong like gym exercise machines could lbs average always wanted,angry
try unpack feel going work becomes angry help,angry
turn story toward something feels happy clappy sweet,happy
turned look back feeling slightly sad id probably never see,sad
typically respond feel offended,neutral
understand anti social behaviour incidents may make feel frightened angry hellip,angry
understand extremely positive attributes overshadowed weakness subconsciously people wired feel superior others thereby treat differently,neutral
understand chose stay choose stay ra feel angry right,angry
understand lot parking garage masses feel wronged,angry
understand anger feeling duped outraged brazen incident backlash reactions indie small press authors significant,angry
understood much time became angry beard listenned respectfully waited finish venting quick feel compunction violent wind delivers bigly,angry
use enjoy weekly thursday posts feel like always something thankful whether big small,happy
used discuss glen helberg unemployed people subject feeling depressed holidays,sad
used feel music gone replaced bitter taste mouth lot sadness,sad
used feel isolated unhappy made feel even seperate people,happy
used feel sad artie wasnt watch,sad
used get worthless feeling like said previously gear going ebay catch bothered go think little fish thin ground dejected angry,angry
usually come sort virtual diary im feeling shitty im much better wont sappy post im feeling depressed kait,sad
usually feel angry,angry
usually dont know day turn terms im mood feel physically mood swings depressed get angry,sad
usually end feeling regretful time wasted come little sadness hole,sad
usually start feel energetic energy attacked next climb enjoying feel tires dirt,happy
usually steer clear vapid morning programming channels watched many people feeling outraged gone programme thought might well check,angry
uttered letters varying degrees feeling friendly exasperation vicious rage,angry
value speaking seeing feeling person real life advancement simply cannot ignored making impact small world community courage offering make impact,angry
much enjoyed build air suspense confusion throughout cant help feel dissatisfied ending,happy
view way growing people constantly made feel like wasnt good enough,neutral
view trials others different light sad feel awful pain faith gods plan well,sad
vividly remember may tornado hit area feelings fear sadness rushed,sad
voice feeling gets angry,angry
wake every morning feeling angry dissatisfied world,angry
wake feeling triumphant,neutral
wake morning voice throat feels ok afternoon scratchy sound like marge simpson night bad throat sore whisper,neutral
walia feels suspicious tarun bani,neutral
walk door house feel happy,happy
walk average american street implied stupid would feel insulted,angry
walked around long time feeling like failure angry allowing conversation define,angry
walked away feeling beaten sad frustrated judged,sad
walked back house feeling discouraged took nap,angry
walked probably feeling less fearful happier content time,happy
want relationship healthy relationship challenges better encourages take risks relationship feel respected cherished safe,angry
want wand whose activation word fuck hippie ryan thatd whither plant paul feel shaken alex hes raging brian im angry frightened time,angry
want passed away feeling good brother grandparents,neutral
want feel uncertain unsettled deserves maybe itll teach lesson,neutral
want child happy certainly want feel punished held back social events,happy
want others happy mean step back yet feels like allow happy deserve even deserve,happy
want people know despite sometimes feel discouraged even frustrated overall feeling collared owned slave im finally achieving genuine joy life,happy
want kind true feel depths soul perfect peace kind joy im going press depend lord remember true justification comes,happy
want ache chest feel emptiness want enraged mind burns blindly need something beyond world beyond earth breaks invisible safeguard formed around,angry
want actually feel sadness know fact im remembering emotionally pained,sad
want least feel intelligent believe becoming well read person help,neutral
want able enjoy things feel tortured dissociated time,happy
want able feel heartless strong defeats whole purpose happy,happy
want able get without feeling weird bathing suit,neutral
want angry feel miserable,angry
want feeling happiness melancholy alike must even failure,sad
want irreplaceable find person makes feel way think id rather stay single im number whats point refuse something settle maybe im stubborn feel idrc,neutral
want positive morning need convince subconscious believing feeling terrific,neutral
want recless im feeling uptight put mamma headlock baby right whooooos got crack whooooooooos got crack whooooo got crack whos got craaaaaaack,neutral
want happy feeling love instead weepy depressed want say fuck go sleep march,sad
want encourage anyone reading post feels hopeless sick,angry
want encourage everybody get streets today feel outraged happened mike happening thousands citizens non citizens united states,angry
want encourage women take time losing baby weight feel discouraged see women bounce back quickly giving birth,angry
want enjoy life feel defective substandard,happy
want enjoy feel successful,happy
want expressly thank everyone hand happiness feeling supporting us sadness know continue thank advance shoulders cry rosy moments road,sad
want feel maybe something feeling convinced nvm state mind due deliberations,neutral
want feel energetic bit exercise every day minutes feel awake energized focused,neutral
want feel insecure confused angry,angry
want feel like reading something worthwhile,neutral
want feel playful open vulnerable great time,neutral
want feel safe well maybe maybe theres small chance feel joy dreams come true,happy
want feel valuable vibrant desperate depressed,sad
want feel worthwhile enjoyable,happy
want get whole antidepressant discussion medical expert give story feel god impressed upon heart situation pray encourage seek good perfect life well,angry
want one person guarantee always always rub scalp sick tickle back carry glass metaphorically speaking course whenever feeling depressed want get bed,sad
want look ahead good times right focus feeling discouraged,angry
want meet someone would change life would make feel happy,happy
want feel angry right feel way,angry
want return home yet feel curious sadness leaving east timor,sad
want save good memories heart anymore making feeling depressed,sad
want say want feel come bitter angry,angry
want spread feeling want others feel wonderful want share joy,happy
want stop feeling bitter amp able give finger amp walk away laughing amp feel slightest bit sad,sad
want talk something sad dominantly come blog feel pressured sad pretty talk random things run around,sad
want talk someone professionally ask questions asking someone feel need fake one sad moods keep worrying,sad
want talk limited time phone current arrangment feel hesitant bring,neutral
want tell feel disgusted hurt husband way laugh treats grandchildren treated husbands mum scream stop selfish bastard world revolve around,neutral
want watch nothing movies like time make feel hateful alone yet sad lovelorn,sad
want wimp feeling outraged,angry
want wimp feeling outraged,angry
wanted knowing nothing stepped candyland make looking haggard left feeling radiant bag full products course,neutral
wanted feel special guests alise jeremy chose,neutral
wanted something else feel really passionate begin spread wings wouldnt feel like sad loss around,sad
wanted create feeling longing sadness,sad
wanted feel respected supported happy peace around person,happy
wanted give trying help anyone feeling discouraged,angry
wanted make sure didnt feel rushed getting century college friday afternoon,neutral
wanted offer customers would feel disadvantaged situation,sad
wanted say something bad vibe feeling hostile didnt think good night,neutral
war diggers metal detectorists feeling depressed,sad
happy single feel blessed met wonderful husband started new chapter life,happy
small child least remember walking around old neighborhood feeling desperately unhappy nothing particular,happy
nice girl unhappy makeup made feel like could hide innocent little self swap tough look pretend care,happy
wee bonny lass ive always wanted go something like nightclub party concert im surrounded hundreds people feel divine spark feel connection joy briefly happy,happy
able experience feeling every scene parts ecstatic jumping joy full sobs,happy
able help chai lifeline support encouragement great feeling glad able help,angry
abruptly reminded feeling agitated la,neutral
already feeling discontent days playing seeing print photos notes really made angry,happy
already feeling pretty nervous prospect suitcase full dvds watched one,neutral
already lying flat bed determined inconvenient therefore best place room get cellphone reception average five minutes clear day checked caller id feeling benevolent,angry
also feeling angry,angry
always stressed always feeling insanely insecure enjoying,happy
angry angry feeling good last weeks angry overworked angry coworker,angry
angry boyfriend promised come see spent evening pals,angry
angry cafeteria cook scolded said many bad things without reason thought among girls wrong,angry
angry close getting one obstacle standing way threatning makes feel helpless,angry
angry close getting one obstacle standing way threatning makes feel helpless,angry
angry made feel victimized result distrustful someone nice bruno,angry
angry sister began talk nonsense laugh way swept room anger grew tried control telling leave alone,angry
annoyed particular day seemad odds favour grandfather added fuel fire,neutral
aware feeling melancholy approached city sans pup,sad
becoming nit picky every little thing put body started feel unhappy,happy
beginning feel bit depressed,sad
beginning feel discouraged even seems like everyone met gone pharmacy school gotten phd worked pharma,angry
bent barefoot damp dirt feeling stork like content,happy
bitten dog,neutral
building angie feeling profoundly betrayed angry,angry
bullied guilt tripped taking decisions led surgery still feel angry,angry
capable late ive feeling pretty bitter depressed lot gratitude general,sad
good crying feeling sad,sad
feeling greedy depressed,sad
enjoying excitement feeling like productive efficient planner extra thrill terror comes trying figure yarn outlast pattern,happy
exhausted sad feeling worthless even years old beginning,sad
fascinated ebb flow water stood feeling content watching waves,happy
feeling bit discouraged words really hit home,angry
feeling bit melancholy,sad
feeling bit melancholy reflection put finger source,sad
feeling bit melancholy evening waited table bar,sad
feeling bit rebellious today,neutral
feeling bit sad thought well youre gonna win anyway might fun er shoes,sad
feeling little bummed discouraged overwhelmed ive living unattractive labels ever since strangely one else family seems mind,angry
feeling little discouraged last year started running,angry
feeling little discouraged going give,angry
feeling little discouraged progress physical therapy month sudden end month amaze active,angry
feeling little melancholy last weekend holidays got back home got christmas decorations put away ready move new year,sad
feeling little sad didnt family trip planned,sad
feeling little shaky called day small bike,neutral
feeling alarmed instant response conversation get angry told listen,angry
feeling depressed fabric prices much money hobby costs,sad
feeling resentful id given boring assignment,neutral
feeling said impatient,neutral
feeling angry jealous deceived,angry
feeling angry feeling self conscious shorts wishing wasnt alone,angry
feeling angry depressed tried think loving happy thoughts,sad
feeling apprehensive life student felt like couldnt succeed wouldnt succeed could never succeed,neutral
feeling lap divine mother holding soft tender arms,neutral
feeling start didnt want move much really glad experience glimpse sort vibrant energy gain year,neutral
feeling bitter angry disappointed unsettled,angry
feeling completely discouraged like wanted anywhere else house,angry
feeling completely shitty thanks chemo side effects therefore ended rage,angry
feeling confused angry well sad,sad
feeling depressed knew snap,sad
feeling depressed earlier year felt somehow failing husband person,sad
feeling depressed asked thinking felt sad depressing,sad
feeling discouraged classes city dance,angry
feeling discouraged flare stopped enemas going gi doctor get prednisone however planned going back enemas week two,angry
feeling discouraged day yesterday,angry
feeling discouraged friends came around pray,angry
