Text,Emotion
feel discouraged read three four letters get back joy purpose spring right back action,happy
feel discouraged drained day takes,angry
feel discouraged every aspect life,angry
feel discouraged choices actions,angry
feel discouraged question im seeing smile reminds music educator,angry
feel discouraged wont able truly work kingdom heaven,angry
feel discouraged feel discouraged href http abundantlygraceful,angry
feel discouraged read bad news realize even strides still could end badly,angry
feel discriminated make angry,angry
feel disgusted embarrased sad handled situation,sad
feel disgusted national media usual talking head personalities seem excel nothing much talking rears blown exploited tragedy cynical gain ratings,angry
feel disillusioned emphasis disingenuous rage latest transgression side false anger indignation posturing obvious belief part many elected officials idiots couldnt find asses hands,angry
feel disillusioned thing throws furthest ever happy illusions begin,happy
feel distracted people think overreacted,neutral
feel distraught worried panicked sick scared sad,sad
feel disturbed sad,sad
feel divine strong,neutral
feel doubtful even struggling bit faith even times seem dark feel alone know god,neutral
feel drained social setting even ive enjoyed,happy
feel drained positive energy filled rage hearing confidence dear friend mine verbal abuse endures every day husbands behalf,angry
feel dull discouraged draft posts piling dull discouraging,angry
feel dull gross encourages drink coffee,angry
feel dumb get angry,angry
feel embarassed humiliated sad miserable href http www,sad
feel embarrassed sadness life still beautiful,sad
feel embarrassed sad even beyond grave seem still working release latest posthumous album,sad
feel empathy melancholy hatred knowing weak,sad
feel energetic bouncy happy go gym run around outside kids take pram long walk often three one day,happy
feel energetic fresh great things eye sight improved lot,neutral
feel enraged,angry
feel enraged jealous cant decide whether,angry
feel enraged weak reasonable grounds,angry
feel enraged write inflammatory response,angry
feel enraged yet calm,angry
feel enraged ridiculous,angry
feel enraged way absolutely accepts ignorance,angry
feel enraged voice wounds ever heal,angry
feel enraged profession chosen twenty five years essentially reduced inadequate pool part time wage earners like star bucks street,angry
feel enraged violated,angry
feel enraged start fighting among referee,angry
feel envious keep posts regular interesting wish could feel way,neutral
feel equally morally outraged regardless whether michigans new yorks governor sleeping prostitutes behind wifes daughters backs,angry
feel especially angry since seeing counselor things much better last months,angry
feel especially lethargic reluctant exercise maybe spoonful peanut butter self encouragement,angry
feel even pressured cook healthy meals eat thorough preschool lessons boys keep house spotless exercise serve church community happy loving wife times,happy
feel everything around fucked everyone around falling pieces,neutral
feel exhilerated going also fearful little sad,sad
feel extremely alone lonely depressed unable trust people,sad
feel extremely insulted,neutral
feel extremely jealous ranbir works directors ayan mukerji filmfare,neutral
feel extremely sad get skype ashli anymore,sad
feel extremly enraged moment containing self im sure controlled rage,angry
feel faithful encourage someone trust god,angry
feel fantastic extremely well rested average sleep time pm past week,angry
feel fantastic find renewed sense strength endurance,neutral
feel far distracted actually write anything substance,neutral
feel fearful,neutral
feel fearful actually one thing usually turns good thing,neutral
feel festive,neutral
feel foolish happy soon let think,happy
feel disadvantaged people want warm sit somewhere clean pleasant,sad
feel frightened,neutral
feel frustrated angry sometimes,angry
feel frustrated angry others mainly concentration goes know even crying lord seems exacerbate self pity good place working irksome thoughts earth shattering fury,angry
feel fucked inside,neutral
feel furious pathetic furious various reasons,neutral
feel generous evening id like share pie crust recipe help struggled trying make pie,neutral
feel glad still teach home,neutral
feel glad teaching nursery children special needs know study art better helped use art curriculum make lessons enjoyable interesting pupils,happy
feel gloomy depressed state world pop bit ol alphabeat perks right,sad
feel greedy idealistic expect would want talk proported best friend might happy,happy
feel greedy traditions joy laughter give,happy
feel grumpy shine feel sad shine feel hopeless shine feel lost shine feel like god hear shine feel alone shine feel defeated shine regardless feel emotions pass light give last,sad
feel guilt cranky last night fully embrace evening alone boy,neutral
feel guilty poppy seed alive enjoying right,happy
feel guilty sometimes enjoying time much nice breather stress school run starts,happy
feel happy hes reason today,happy
feel happy outcome long election im glad,happy
feel happy sorry perform song,happy
feel happy fix problem upset question say culture,happy
feel happy inside,happy
feel happy like top world thrown jumping jetplane feet ground,happy
feel happy enjoying changes life looking forward unknown good times yet come autumn winter suddenly new steps journey,happy
feel happy science india getting due recognition,happy
feel happy named best player kenya means improving,happy
feel happy together,happy
feel happy wheni visi,happy
feel happy hide feelings miss thing used,happy
feel hated feel angry feel sad feel like im going abandoned feel angry abandoned someone reality one age expect neither party abandoned,sad
feel hated feel angry feel sad feel like im going abandoned feel angry abandoned someone reality one age expect neither party abandoned,sad
feel fabulous birding weekend everyone,neutral
feel convinced many factors culture kind cooking mystique,neutral
feel gotten complacent purchases getting outraged non issues wrong thing,angry
feel heartbroken work art stricken sadness,sad
feel helpless able help feeling better best encourage think positively mom,angry
feel helpless able help feeling better best encourage think positively mom,angry
feel helpless angry hurt,angry
feel helpless discouraged country mask sarcasm humor,angry
feel helpless sad heartbroken,sad
feel helpless cannot stop,neutral
feel helpless cant protect family adds,neutral
feel helpless taming things try go happy place,happy
feel helpless like want hurl cave sadness trying devour,sad
feel helpless like want hurl cave sadness trying devour,sad
feel helpless sad despair sometimes end big black hole depression thinking suffering world,sad
feel hesitant putting words page feeling like every time hit key tempting fate take away,neutral
feel hesitant comment want add pileon seems clear involved learned past experiences interested applying learning future projects,neutral
feel hesitant since experience programming,neutral
feel hesitant label feel sadness,sad
feel highly disadvantaged,sad
feel highs ecstatic normal feels like thousand mile drop unhappy excruciating,happy
feel honored art going fill room sick children need joy get,happy
feel honoured happy going way want thank players fans media,happy
feel honoured clients walk doors sometimes first time trust brand new one week old bundles joy,happy
feel honoured chosen share,neutral
feel honoured opportunity work different types people experience skills encouragement,angry
feel hopeful recovery content taking care,happy
feel hopeless helpless outraged,angry
feel horribly restless,neutral
feel angry sad get,sad
feel humiliated discouraged,angry
feel humiliated retarded angry upset frustrated scared resentful guarded worried,angry
feel humiliated violated angry,angry
feel hurt angry tired fight,angry
feel disturbed saddened angry bereft,sad
feel forever depressed constant suicidal tendency makes sense person situation,sad
feel relate post feel persuing mothers dream haveing children successful get good education general great happy life feel dream goood happy life eventually dream future children,happy
feel dont deserve anything pain would slightly mellow dramatic think certain level comfort unhappy,happy
feel benefited last year creative futures could part information learnt last year already putting practice therefore year sessions already rather inspiring start,neutral
feel hated despised yet make happy even sad matter minutes,sad
feel enough content multiple blogs seized desire create multiple blogs appropriately,happy
feel look trusting soft emotional sad eyes tormented maybe,sad
feel missed thoroughly enjoying short stage life,happy
feel disadvantaged writer modern education methods came,sad
feel share much hurt sadness fear still feel every,sad
feel outraged insulted,angry
feel unhappy years happy ones,happy
feel disadvantaged gender,sad
feel wear wear show girls school timid comes fashion look weird walk around head held high,neutral
feel unhappy continue like also heartbroken girlfriend split,happy
feel id quite content living cave listening rain losing creations austen hardy dickens,happy
feel learning purpose workings universe continue evolve transcend productive along journey,neutral
feel ignored certain ones inactivity understand although become even depressed,sad
feel im bitchy seeing parents gotten little depressed,sad
feel im bothered,neutral
feel immensely distracted barrage media receive solicit,angry
feel long run hurts paulie could visibly see distraught result perception performance,neutral
feel talk brother law extremely popular one think stiff,neutral
feel incredibly charmed people life exciting amazing chapter things,neutral
feel incredibly remorseful dont know make sadness stress stop,sad
feel indecisive feels like security usually feel sensing ground beneath feet suddenly gone left feeling wobbly unhappy,happy
feel indecisive whether feel book huckleberry finn censored,neutral
feel infuriated kind sad,sad
feel infuriated every time christmas season draws near,neutral
feel insecure time,neutral
feel insecure around people marvel people humble,neutral
feel insulted offended hurt,neutral
feel intensely resentful angry permitting part stolen,angry
feel invigorated physically emotionally sound quite happy,happy
feel irritable depressed course day stop think hungry angry lonely tired,sad
feel irritated early onset holiday marketing push enjoy october looking christmas trees,happy
feel irritated pissed even like someone wakes moment edge falling deep slumber,neutral
feel irritated students get participate activities enjoy however happy see students taking action get extracurricular activities back,happy
feel irritated useless hopeless,neutral
feel disadvantaged position,sad
feel hostile kinship mounting nausea know back means binding,neutral
feel acceptable violence could lessen much violence could also apply discussing,neutral
feel perfect date night hubby dinner dolled enjoying people watching uninterrupted thoughts,happy
feel thankful lessons learning,neutral
feel unfortunate product information age live literally thousands individuals garage inventors start ups auto manufacturers trying green motoring better rest,angry
feel solemn duty share divine knowledge mine order others may benefit truth beauty render world tad closer thearchitecturality utopian perfectly set garage society strive,angry
feel gentle flying carpet way angry like throw quickly grasp handrail gradually gently,angry
feel worthwhile document people familiar batch files,neutral
feel acceptable put forth little effort today post,neutral
feel takes lot time focus successful also fortunate still take time work enjoy life,happy
feel beams face brightning smile making world gleam gleam vivacity radiant joy sparkle beauty life like gem yet milder gentler light somewhat coy smile beaming brightly,happy
feel songs came deepest longing joy pain touch places hearts people listen,happy
feel casual straight,neutral
feel foolish angry year old,angry
feel jealous everyone chance meet everyday,neutral
feel jealous enjoy life without thinking dont like,happy
feel jealous whenever relationship dont get talk anymore,neutral
feel jealous,neutral
feel joy look triumphant sense ownership like want jump simultaneously,happy
feel joy bit melancholy spice,sad
feel like everybody else outraged experience happen invisible makes invisible everyone knows chickenshit anything,angry
feel picture solemn pouty sad face instead,sad
feel kind disadvantaged way guess really lose weight prize bonus,sad
feel kind reluctant depressed told respected decision,sad
feel kind reluctant depressed told respected decision,sad
feel kind sad ebook readers cant single kindle tablet,sad
feel kind sad writing youre reading think warm goodbye img src http media,sad
feel kinda sort angry,angry
feel kinda outraged,angry
feel lame sad disapointed unimportant,sad
feel less agitated bit sad sometimes,sad
feel less bitchy morning,neutral
feel less happy less much introverted,happy
feel less intimidated help,neutral
feel like buffoon enraged,angry
feel like distracted robot,neutral
feel like greedy person liking two people,neutral
feel like heartless feelingless know word daughter teenager,neutral
feel like lot people discontent feel anywhere offer lack,happy
feel like mouse among men perpetually terrified,neutral
feel like paranoid annoyance reality wouldve talked anyone way,neutral
feel like petty murder shoudlnt punished nearly heavily human beings constantly shitty human beings,neutral
feel like rebellious year old stands doorway flicking lights depths spirit,neutral
feel like shitty mother disengaged children sad truth dont want engaged,sad
feel like vile traitor even saying thing truth,neutral
feel like woman respected times therefore made right decision said,neutral
feel like affirmation however petty really need,neutral
feel like im going go prepare another vigorous week serving lord sadly know isnt true,sad
feel like angry gorilla time always ready chew someone face,angry
feel like ungrateful jerk happy pressure happy eats away chance might im alone anymore either,happy
feel like time anyone gets ring intimidated arms legs dont even really try,neutral
feel like creative professional need unpressed creative outlet get inspired,neutral
feel like sociable anymore,neutral
feel like calling bitches wasnt exactly bitchy coz wasnt intentional could call ungrateful inconsiderate selfish ok ill say bitches,neutral
feel like cold hands clasping life courage cut knees tonight need make dont strength carry legs wish somehow different dont know wish could still want tell come ill take,angry
feel like crap sad depressed shaky defeated sorrowful,sad
feel like drinkin drinkin angry someones gonna die whiskey beer les paul href http farm,angry
feel like every day blur running irritated son something pertaining making dinn,neutral
feel like everyone shocked horrified saddened angry,sad
feel like everyone unhappy,happy
feel like garbage discouraged something learned anything spiritual bag tricks always feel better,angry
feel like god prompting us visit sad places way back november,sad
feel like sweet carby yet low glycemic meal breakfast often dessert,neutral
feel like enjoys celebrity enjoys talented quarterback led celebrity,happy
feel like keen idea,neutral
feel like hell coughing coughing coughing mad sad,sad
feel like hes really supportive things enjoy,happy
feel like try stay faithful possible perceives real events happened mountain,neutral
feel like pissed spend entire extra year school stupid biochem,neutral
feel like actually missed thing perfectly content even happy days lot life,happy
feel like fearful first threw leg top tube surgery,neutral
feel like deprived discourages makes want quit,angry
feel like obnoxious posting every three seconds,neutral
feel like one angry suffering loss stupid cancer unfairness even though nothing right,angry
feel like movie like world watching want give impression fineness control tragic tragic melancholy,sad
feel like depressed,sad
feel like really grouchy days get moods feel like world,neutral
feel like take world even says wont afraid discouraged,angry
feel like cant brave,neutral
feel like cant take anymore told boyfriend furious,neutral
feel like get easily distracted making things switch around many different projects throughout week,neutral
feel like get way pissed sad things people seem even notice,sad
feel like got resentful tired wanted talk badly,neutral
feel like plan make happy allow help family better many ways,happy
feel like pleasant light smile face guy screen looks angry dejected,angry
feel like bit obnoxious picture posting,neutral
feel like really cranky school days,neutral
feel like energy still angry bitter sometimes forget bit actually good mood remember run,angry
feel like offended goal people today along way shared makes cooking joy,happy
feel like reached plateau im buying much use feeling satisfied wardrobe personal style,neutral
feel like robbed joy experiences life afraid stunted,happy
feel like preface post w disclaimer sort enraged peta something equally horrible,angry
feel like redeem even though think realized distraught ok,neutral
feel like treat everyone important time think important hurt angry like leave,angry
feel like constantly switching joyful satisfied life depressed feeling life purpose meaning,sad
feel like roller coaster craziness keep mind throne precious lady anything keep way even means killing people around,neutral
feel like treading kind dangerous water sounds like could trying make deranged argument little eleven year old rape victim texas one lucky stiff nytimes swoop give shitty biased coverage case,angry
feel like uncertain things certain,neutral
feel like need cute pictures share,neutral
feel like sabotage friendships unhappy,happy
feel like also mention content wasnt thrilled either,happy
feel like happy im,happy
feel like lively smarter always sad inside lackcing witts think,sad
feel like outraged,angry
feel like suspicious im happy see,happy
feel like call carrie underwood write kind angry country song,angry
feel like document happenings around lot people happy lot people,happy
feel like quit everything sit room day write sad poetrys existential angst,sad
feel like rely entirelly gods word yet impatient wait,neutral
feel like smell pretty use,neutral
feel like smell scent taiwan quite frequently cute coffee shop bathrooms,neutral
feel like always blamed things always people angry automatically assume somehow something,angry
feel like put bag shaken otherwise ok,neutral
feel like regained another vital part life living,neutral
feel like rude ass hole hookah,neutral
feel like isnt happy one,happy
feel like try even harder rather allow discouraged trial last long,angry
feel like always unhappy anything anyway,happy
feel like im assaulted constant flakiness,neutral
feel like im much contented place nice,happy
feel like im carrying weight feeling discouraged angry things going way,angry
feel like im falling apart happy short week week next,happy
feel like im left standards judge writing thats unfortunate means could revise something thousand times still find something im unhappy,happy
feel like im putting innocent man death row,neutral
feel like im enraged,angry
feel like im enraged,angry
feel like im tortured like years ago,neutral
feel like watch cute frolicky enjoy naive cute little comments start howl walk away look back,happy
feel like looks gorgeous curls instead making full transition ended getting extremely natural red lowlights bottom section hair,neutral
feel like must popular choice alterations done elsewhere,neutral
feel like worth trusting,neutral
feel like petty worried,neutral
feel like ive become relaxed parent,neutral
feel like ive sooo distracted need regain focus,neutral
feel like ive working project forever im thrilled say happy stacker finished,happy
feel like life gave plenty changes shine pissed every one,neutral
feel like many us see five game losing streak become paranoid business usual team enjoyed postseason invites since kg sprewell cassell era,happy
feel like finding stupids things bother making unhappy,happy
feel like uhhhh feel like something precious catches eyes takes main lights lights candles putting front table gets camera starts clicking pictures feeling content baby,happy
feel like faith shaken discourage would remember brother christ would say remember roots,angry
feel like fake smile looks sad eyes look enraged,sad
feel like go emotion angry,angry
feel like go emotion angry,angry
feel like life practically perfect every way right every happy,happy
feel like role would tear sails pessimism discontent,happy
feel like perineum subjected hours violent kicking enraged footballers maybe form world war torture technique grateful bit additional meat bum absorbed hardship believe enough,angry
feel like work vain boss happy see leave job spent life know well performed duties high obstacles could stopped,happy
feel like nobody understand sadness sweet though sour taste,sad
feel like normally would angry thats actually think could never beautiful size,angry
feel like opportunity become smart embrace knowledge really learn everything daydreamed learning,neutral
feel like one sad old adults still student im envious make,sad
feel like people always say im rich ill get record deal ill happy fuck,happy
feel like people like arent getting caught therefore government plays catch criminals petty crimes make look better,neutral
feel like screaming discontent,happy
feel like bitter towards people upper class upper class,neutral
feel like would feel jamie took advantage enraged,angry
feel like punished way reckless abandonment enjoyable medium,happy
feel like much life rushed like means end feels like enjoying everything possibly truly,happy
feel like leaves artistic equivalent crack couch cushions,neutral
feel like character precious,neutral
feel like disadvantages weigh advantages cause unpleasant side effects like nausea drowsiness always effective biggest thing affect baby heart rate make baby less alert birth,sad
feel like earthquake also shaken foundations life work,neutral
feel like saddle got way inhibited power output,sad
feel like sequel ok overrated great many deem,neutral
feel like thing im nervous two kids,neutral
feel like thing call artistic tendency really laziness narcissism justifying strengthening,neutral
feel like uterus angry pouting,angry
feel like theres dangerous chance im pulling quixote blinding rushing windmill eventual marriage future child,neutral
feel like thrilled part experience gives family joy havent sooo long,happy
feel like insecurity good thing first started writing pictured,neutral
feel like im supposed im slowly coming depressed rut phase happy accepting liberation phase,sad
feel like rich people fall category belong see bus,neutral
feel like rushed around trying see things still quite beautiful,neutral
feel like live world people unhappy work dream things lives,happy
feel like rushed weekend,neutral
feel like girls looking gorgeous enjoying early years im fat frumpy invisible,happy
feel like mad sad sing try time,sad
feel like feel mistake time fucked sleep take,neutral
feel like completely satisfied results,neutral
feel listless angry dont know,angry
feel listless sluggish endlessly sad,sad
feel lonely feel sad,sad
feel longing sadness happiness overwhelming heart cannot contain,sad
feel low whenever feel happy whenever something significant happens life affects make point write,happy
feel lucky feels complete content us,happy
feel mad sad discouraged something marvelous lord jesus something holy word god ignites soul hope keep moving forward,sad
feel mad upset sad happy,sad
feel many faithful catholic feeling way need courage say,angry
feel many faithful catholics feeling way need courage say,angry
feel melancholy home,sad
feel melancholy homesick,sad
feel melancholy yellow yibo done many even standing much like chief yet chief recognition fair metropolis wuhan tentative product also established local central rebuttal,sad
feel melancholy seems nothing left anymore isnt tied mum wife,sad
feel morally outraged furious often like,angry
feel morally outraged furious often like,angry
feel stressed,neutral
feel angry hurt helpless affect anything world,angry
feel angry guilty,angry
feel anxious quite time fact,neutral
feel content maybe smidge hopeful partially vented,happy
feel content years knowing chant dead,happy
feel content achieved know write today still tomorrow,happy
feel free enjoy possessions like rock book clothes,happy
feel grounded less fearful,neutral
feel hostile towards sarcoidosis usual,neutral
feel intelligent strong,neutral
feel isolated felt long time makes even angry time look window think go walk pineapple whole foods,angry
feel joy anticipation divine right,happy
feel optimistic less melancholy,sad
feel outraged video game someone using stolen credit card go home depot imagine someone finally able afford materials fix plumbing,angry
feel resolved less like smoking lungs today obviously happy,happy
feel sad anything,sad
feel sociable days,neutral
feel sorrowful people feel angry,angry
feel terrified customers maze,neutral
feel persuaded enjoy watching horny gay doctor tease measure young twink dick,happy
feel content right world,happy
feel content calmed,happy
feel writing fits description enjoy looking strange unusual things life,happy
feel time though always show quite happy quite sad either exactly,sad
feel passionate artistic settled craft,neutral
feel welcomed encouraged authentic self appreciative support system,angry
feel much better without help ice,neutral
