Text,Emotion
monthe ago,neutral
friend mine goes guy sleeps quite happy play around well,happy
girl entered division work greeted everybody,neutral
car sadness felt anger way acted negotiating,sad
funeral acquaintance felt depressed feeling turned joy heard achieved good grade examination,sad
sadness,sad
certain situation felt neglected undeservedly harmed,neutral
absolutely adore feel sad significant event happens without pomp ceremony doesnt even make news,sad
accept good gifts god feel angry others get,angry
acted like little girl acting cute towards asking wanna share diary amp said youre still feeling pissed want stop adding problems make things hard us,neutral
actually want see especially since feeling sad lonely whole day,sad
actually feel content,happy
actually feel hopeful today,neutral
actually feel experiencing someone viscerally enraged,angry
actually feel insulted plot goes tangent like,neutral
actually get depressed takes awhile realize going b feel outraged depressed,sad
actually wanna marry white guy someday never dated white guy way feel disadvantaged,sad
admit inspiration go direction feeling little melancholy making href http www,sad
admit past ive done lot time scoffing feeling superior christians,neutral
admit thoughts go head feel doubtful times coz im scared,neutral
admit comparing heart palpitations assessed math standard lower average feeling smug began reading year old books,angry
admit feeling slightly alarmed book also based olden sarawak seemed parallel plot lines jugra chronicles,neutral
admitted silently darkness pain stuffy nose unremembered bad dreams could easily result waking feeling discontent sorrow,happy
feel like going friendly safe environment booking flight pe,neutral
aint happy im feeling glad got sunshine bag im useless long future coming coming coming rah yeah coming coming,happy
aint pissed angry mad anything feel pretty much fuckin insulted,angry
allow old thoughts run course focus negative things happened together find familiar hell place angry feeling victimized powerless,angry
allowed know always loved airports feeling adventure connection strange place terminals cold clacking heels overpriced bagels felt deeply sad,sad
almost feel confused character honestly say actually things going pretty well,neutral
almost feel envious people wake morning look window enjoy view even better take little stroll look water,happy
almost want error side high makes feel depressed allowed feel crappy ill time,sad
already feel impatient cancel hyundai tucson last year waiting almost seven months,neutral
also dont personally find last one particularly true dont feel isolated insecure life happy,happy
also enjoyed dephyant earlier ep critical beatz feel though dirty pairadice showcases refined collection lyricism dephyant trying hand different styles,happy
also feel discontent greed behind,happy
also feel angry mad bitter anyone,angry
also feel contented humbled experience always thankful opportunity,happy
also feel extremely blessed marrying loving family,neutral
also feel rude see family doctor approach together ailments,neutral
also feel really angry family,angry
also feel regretful sad,sad
also feel blessed new relationship jesus christ vcf family continues give encouragement ministry called serve,angry
also feel people village friendly need alert manila though common sense rule still stays let guard,neutral
also feel depressed lonely stressed,sad
also periods days sometimes weeks feel legitimately depressed lot trouble getting bed going day,sad
also admit feel suffocated thought terrified sad,sad
also honest post almost didnt happen woke feeling shitty cranky angry today going bed feeling shitty cranky angry last night,angry
also hope understand feel angry dont support hat rule turn school event sans hat,angry
also remember feeling stressed getting angry felt angry,angry
also start feeling agitated even melancholy,sad
also wouldnt mind canon mark iii anyone feeling generous,neutral
alternated wishing would die feeling terrified something would happen leaving newborn son without mother,neutral
always complain nobody listens expressive speak beats heart decided write whatever comes mind various time life sad feelings romantic ambitions friends keeps telling express,sad
always end feeling unwelcome sad,sad
always enjoy meeting new people learning new thing especially makes feel accepted,happy
always feel bit melancholy summer turns fall,sad
always feel little sad goes sorta ren stimpy theme us oil water gemini scorpio soulmate friends,sad
always feel little suspicious kind tradition cannot accessed average person smacks little gnostic heresy,angry
always feel angry,angry
always feel contented big word,happy
always feel devastated angry fellow filipinos used filipinos,angry
always feel fake happy like real,happy
always feel depressed winter,sad
always feel pressured socialize get eight missed calls texts host brother span hour,neutral
always feel really good happy glad married utah uvu house im,happy
always feel relaxed happy,happy
always feel sad people say days seem,sad
always feel sad friends live far away babies,sad
always feel burdened sadness sometimes fear whats going world,sad
always feel leave kind sad kind nervous kind like family incomplete,sad
always get questions blocking classes topic feel pretty passionately knitter teacher,neutral
always get feeling letting go anger somehow defeated person person never learn simply choose angry,angry
always get sad feeling song really love becomes popular,sad
always notice even though fabulous hiding according rest world feel keenly greatly distressed,neutral
always sad amp feeling alone,sad
always try compliment feel ugly inside im depressed,sad
bit impractical thoughts feel makes life less doubtful,neutral
food blogger feel really need back time moment highlight delicious plate food enjoyed friday evening summer work picnic,happy
martyr feel superior feel isolated often feel angry resentful nothing ever good enough,angry
person sometimes feels jealous sometimes feels happy sometimes feels sad excited afraid angry confused,sad
able give feelings rude people depressing situations death news tragedies,angry
afternoon activities im also feeling quite distraught tragedy morning ct,angry
agreeing feel tightness tenderness around heart distracted slow pace well sad,sad
allowed feel sad angry annoyed certain things,sad
alone like way lately ive feeling loneliness sadness discontent alone,sad
alone feeling melancholy tend produce better art better poetry deeper thoughts,sad
already feeling frantic,neutral
also aware glamour sometimes want feel glamourous know,neutral
also feeling smidgen melancholy,sad
also feeling slightly sync little bit angry,angry
also glad strong enough relationship husband express im feeling mad bad sad,sad
also lbs feel good still another go least well thats plan anyway,neutral
always sad boyfriend goes away lives studies city gone steady years everything going well,sad
dont know maybe weather feeling little melancholy feel way tend drift past think better times life sometimes good well,sad
angered enraged feel quite disillusioned people,angry
angry times ever taken granted made feel less worth precious time made feel bad made cry,angry
angry feeling like feel like ungrateful little blessing true gift god growing inside dont feel ungrateful sound ungrateful,angry
angry eating easier feeling unpleasant feelings,angry
angry think lost much needs right sad longer part life think everything much faith much trusted feel humiliated grateful everything,sad
appreciative people happy feeling hopeless bitter even content,happy
makes feel nostalgic sad,sad
ashamed feel like moment see terrified crying children dead ones,neutral
deep level feel real contented,happy
mercy others makes feel angry want shit,angry
back home feeling irritable since ive looking forward party week,neutral
beginning feel annoyed frustrated angry taking long time something rudimentary dressing,angry
beyond lucky supportive husband pushes follow dreams encourages im feeling bit shaky,angry
bloging sitting feeling content dogs amp cat etc know lucky truth,happy
busy sorting interior cupboards course lots stuff still storage feeling even remotely smug neat organisation behind doors premature,angry
means claustrophobic crunched like help feel little agitated,neutral
capable feeling content,happy
curious feel victimized traumatized outraged events none feelings enter,angry
deeply saddened cruel bullying invasions privacy whether face face internet especially leaves teenagers feeling distraught believe recourse take lives,sad
definitely feeling rather enraged moment,angry
depressed feeling worthless getting gmc denali bike conquering miles makes feel less powerless,sad
depressed feel less vital lenny squiggys last sperm count,sad
depressed feel timid shy speak much get manic speak loudly forcibly though words heard,sad
depressed feeling hateful lowly entitled rude unsociable look talk people,sad
moment feeling melancholy wondering could everything wanted,sad
easily rubbed wrong way feel cranky sad,sad
excited sad feel like wonderful bubble kids,sad
fairly sure feeling discontent life projecting onto church community,happy
feeling bit adventurous put red lipstick rouge artist intense make ever,neutral
feeling bit depressed,sad
feeling bit depressed funk,sad
feeling bit depressed today doubt tummy seemed nothing much changed yesterday visited kabalega primary gave one computers kindly given,sad
feeling bit discouraged,angry
feeling bit discouraged hopefull bees know,angry
feeling bit melancholy see section mates friends entire month,sad
feeling bit melancholy heartbroken devastated like href http everybookeverwritten,sad
feeling bit unsure im going give try anyway,neutral
feeling combination smug happy,happy
feeling little apprehensive sad leaving bella four nights,sad
feeling little intimidated riders central park right dont want go,neutral
feeling little melancholy today would brother billys th birthday,sad
feeling little sad today,sad
feeling little sentimental saw rina heartbreaks joys go lot get today,happy
feeling tad bit melancholy,sad
feeling absolutely enraged right bathroom incident happened morning happened six years ago,angry
feeling adventurous extra musical,neutral
feeling afraid cos isnt answering,neutral
feeling afraid excited happy nervous proud sad strong,sad
feeling kinds melancholy,sad
feeling melancholy,sad
feeling word ever use melancholy,sad
feeling apprehensive move worried blown money meant pay rego,neutral
feeling bitchy bitter depressed,sad
feeling brighter energetic today lots joy life chucked today care grey day today,happy
feeling content,happy
feeling curious little sadistic,sad
feeling deeply offended big hurt feelings fact,neutral
feeling depressed everything oh depressed feeling coming back,sad
feeling depressed anxious,sad
feeling depressed questioning self worth,sad
feeling discouraged,angry
feeling discouraged things today stopped think,angry
feeling discouraged regressed worth,angry
feeling discouraged exhausted kind lost,angry
feeling discouraged looks ways build,angry
feeling discouraged call supportive people growth group remind capabilities gifts thinking thoughts true,angry
feeling discouraged doubting life choices,angry
feeling discouraged today,angry
feeling discouraged uninspired like dont measure,angry
feeling dissatisfied unhappy direction life going always get haircut makes feel better,happy
feeling especially lively,neutral
feeling extremely contented decision home educate,happy
feeling extremely discouraged feeling positive finding job,angry
feeling fairly contented,happy
feeling fairly uncertain things right moment,neutral
feeling far less melancholy expressed realized james must enough,sad
feeling fearful upset situation life notice reminder sitting right begin repeating affirmation,neutral
feeling fine feeling big sad im working,sad
feeling frustrated angry husband general,angry
feeling generous pick reason like make sure take wise mothers advice dont feel need drag court,neutral
feeling grouchy,neutral
feeling grouchy angry,angry
feeling happy,happy
feeling happy positive bowel hand become grumbling mess back hip pain slowly creeping back life,happy
feeling heartbroken try fight tide pushes sad lonely place filled harsh sounds minds,sad
feeling honored grateful blessed get spend day remarkable th graders,neutral
feeling impatient havent blogging day pretty similar sleep eat pregnancy pains sleep etc,neutral
feeling increasingly angry right,angry
feeling irritable angry,angry
feeling really ok,neutral
feeling joyful sad never cease fill peace joy ask,sad
feeling like might look little suspicious go home dont meet,neutral
feeling like many angry beleaguered frustrated constant stream dire information country run ground,angry
feeling listless appreciated fed without much direction enough courage make changes life,angry
feeling lonely sad anger desperation frustration rolled one,sad
feeling melancholy early days april could look ahead blog calendar marvel alphabetical possibilities,sad
feeling melancholy fact first born back school,sad
feeling messy confused bit depressed,sad
feeling discouraged,angry
feeling positive less sad focused happy little hungry thats havent tea yet relaxed,sad
feeling much less depressed better outlook life,sad
feeling nostalgic toronto adventures right thing stands sad images favourite apartment fireplace,sad
feeling overwhelmed depressed lilli needs go back read wrote lilli eighth birthday remind born purpose created way reason,sad
feeling particularly inspired watching documentary happy mix things bit happy fy little family,happy
feeling peaceful happy someone whos forced listen frank sinatra horrible hokkien song background,happy
feeling pretty shaky sad,sad
feeling quite disorganised distracted wish could answer questions seem unable block forget answer logical answers uuuugh,neutral
feeling quite organised year wrap catch post thought would share picture cute little cleo enjoying warmer weather much constantly darting house,happy
feeling rather grouchy morning since didnt sleep last night purpose,neutral
feeling rather melancholy tonight thinking two,sad
feeling really contented relaxed results,happy
feeling really depressed today wrote whateve,sad
feeling really positive happy,happy
feeling really really discouraged,angry
feeling rebellious often suppose,neutral
feeling seriously angry today,angry
feeling shocked sad relieved amp worst dream ever,sad
feeling slightly apprehensive tomorrow crim exam hefty weighting point sweating buckets reaching razor blades,neutral
feeling blessed happy,happy
feeling depressed find clue overcome,sad
feeling discouraged today,angry
feeling grumpy today,neutral
feeling happy got crafting,happy
feeling much sadness realising gone life like celebration longer harden hide scared others,sad
feeling overwhelmed anxious lonely sad,sad
feeling sad right,sad
feeling thrilled moving forward plan achy back making sad day,sad
feeling festive dressing elf work since saturday haha eventually courage put pic href http,angry
feeling welcomed happy new position,happy
feeling kind jubilant sad,sad
feeling somewhat melancholy,sad
feeling sorry day im supposed nothing happy,happy
feeling sort melancholy really,sad
feeling discontent,happy
feeling need consolidate step back evaluate purpose blog providing fabulous vicarious life yall live sarcasm always come across print,neutral
feeling strange mix extremely proud relieved path fabulous future gutted chosen move live halls residence uni,neutral
feeling totally listless weak super sad,sad
feeling unhappy hours attitude wondering someone else help us,happy
feeling contented life moment hopefully lasts,happy
feeling cranky christmas,neutral
feeling melancholy weepy left thomas brian,sad
feeling restless irritable discontent,happy
feeling stressed means shitty problems life coming back full force gonna finish blog fast forward ads let enjoyment peace last,happy
feeling unhappy pretty sorry right,happy
feeling virtuous today,neutral
feeling weird feel wanna know,neutral
finding makes feel fidgetty irritable sit play snuggle stuff sad,sad
fully aware lucky nice life still feel depressed makes hate anything,sad
getting good reviews first movie feel happy said,happy
glad blogosphere exists given lots people chance voice opinions internet sometimes feel little intimidated sheer demand new content time,happy
going add photos today thank dear support feeling overwhelmed different moments,neutral
going enjoy feeling reaching goal wasnt really sure ever would,happy
going get even comment anything write feel thrilled someone thought enough wrote take time busy day tell us enjoyed,happy
happpy get good results field academics athletics,neutral
happy laying bed feeling lethargic missing life,happy
happy report four days feeling crappy finally feeling like,happy
happy report despite feeling twinge melancholy sentimentality years events life never better,sad
happy say three years writing feel accepted,happy
happy see hurts become unselfish abandoned feeling heart happiness happiness uncertain,happy
happy see hopefully good job help feel little greedy,happy
happy news comeback feeling agitated fangirls,happy
dreams night threatening people knives screaming like banshee locked car feel frustrated lost angry dont even know begin sort mess life,angry
extreme difficulty go semester feel unhappy unhappy,happy
felt blood rushing im feeling angry really annoyed emotions mixed went mumbo jumbo like roller coaster ride,angry
identifying lots things im feeling angry,angry
go back hostel break feel anxious get back see take,neutral
im sure must feel outraged,angry
recovery feeling less groggy ready beverage snack href http,angry
current state mind determines post much content direction body sometimes feel like posting cute pictures pets,happy
feeling grumpy sore,neutral
feeling impatient happy pace chosen path chosen next steps want done prooooooooceeeeeeesss going,happy
hurting much something even think words write weeks feel lord creating content life may eventually come words,happy
sad actually feeling low whole time,sad
justifiably angry boy feel bitchy,angry
learning daily basis living reality fantasy feeling moment happy sad life experience fit spiritually,sad
left feeling enraged saddened extremely disappointed,sad
left feeling happy time rest take care time huge sense guilt builds inside respected date unreliable teacher selfish friend,happy
left feeling unsure confused,neutral
left feeling confused blah,neutral
letting feel depressed angry resentful jealous day taken away unexplained reason,sad
months medication feel fantastic,neutral
mostly feeling contentedly terrified,happy
mostly feeling contentedly terrified,happy
longer feeling melancholy things,sad
allowed feel sadness loneliness heartbreak without dubbed emotional wreck,sad
depressed exactly want motivate art something make money feel survive world without anybody supporting financially,sad
well feel unhappy,happy
even italian feel outraged stupidity ppl blog,angry
even sure formulate thoughts since put feeling slightly overwhelmed,neutral
feeling lonely instead enjoying things make office good place wit rapidly moving computer clean smoothly finctioning keyboard fresh hot strong coffee yum,happy
feeling fearful,neutral
feeling jolly enjoying beautiful october lots blah blahs,happy
feeling energetic today breathing bit tight today watched christmas movies today goodness realized sad sounds anyway,sad
feeling well grouchy lazy ill sometimes forego bed favor futon couch little shut eye,neutral
giving feeling discouraged,angry
okay feeling annoyed life time,neutral
one talk feelings recently accepted fact might depressed,sad
really pvp player even starting enjoy real pvp pve quests feel like starting useful,happy
sitting home licking wounds day day feeling melancholy baby,sad
sure needed hear joe anne today already feeling discouraged,angry
sure would make feel content anything,happy
sure feel numb sad,sad
talking different opinion writing feel differently linking source writing popular blogger content sure fire way failure,happy
thinking certain person sleep end strange dreams wake dreams feel shaken stunned,neutral
good cooking feeling sad process creating something soothes,sad
often left feeling frustrated bitter discouraged,angry
often stunned find feeling unhappy sad,sad
feeling listless depressed,sad
really enjoying tai chi weapon feels flowy elegant,happy
really happy cross arms hand holdings playing fingers stroking hands feel sweet,happy
really happy results eyes still feeling fabulous,happy
rejected twice feel discouraged ask,angry
sad feeling alone confused,sad
sad feeling confused know battle lose,sad
sad also feel really lucky got know,sad
sad even dreaming struggle feel resigned arm goes around,sad
sad write make feel calm,sad
seriously sad feel like missed,sad
sick feeling sad upset lets angry angry handle,sad
slowly paying debts feel generally happy im,happy
aware indulge wounded self first thoughts feel impatient burdened make sure loving adult charge thinking second loving thoughts feel happy blessed peaceful,happy
disgusted dont know feel depressed unwanted,sad
excited reminds feeling accepted saline ambassador,sad
fucking sad angry right feel completely shitty fucked,sad
happy feel blessed,happy
happy yet feel enraged,happy
sad feel like im punished didnt anything wrong everything supposed right way nothing look around everyone around baby,sad
sad im starting feel hateful,sad
sick feeling unhappy,happy
sure also unsure able see mothers experiencing thing makes feel less discouraged,angry
sorry feel unhappy isolated,happy
starting feel get angry insecurities,angry
still angry feel dull twist pull stomach black square weight nestled chest,angry
still feeling angry helpless,angry
still feeling discontent restless able chat last night stopped wally world picked panty hose brownies,happy
still feeling melancholy strange sense loss homesickness,sad
still numb question everything feel terrified trust feelings,neutral
still track goals feeling discouraged slow progress,angry
sure everyone us felt feeling least us might get agitated easily,neutral
sure mom sad feeling gloomy,sad
sure organisation best intentions though disagree whole heartedly get feeling demostrators slightly hostile students,neutral
sure pleasure living open air sky roof ground table part feeling savage returning wild native habits,neutral
telling positive stories make feel happy energized powerful good universe,happy
thankful moment feeling cold air morning cheeks sun back afternoon curl night dear comfy bed warm snugly sweet moments happy thanksgiving,happy
thankful safety loved ones loved ones friends guilty feeling selfish deeply saddened people back home cannot say,sad
thinking md teen years offering guidance support making feel special making feel like matter,neutral
thinking entrepreneurial spirit traits feel make contented happy self employed person,happy
thing feelings afraid express stand believe,neutral
thrilled lot things feel petrified,neutral
tired feeling angry guilty something,angry
told dont go funerals mourn death celebrate life go funerals support remaining family one certainly dont feel like celebrating feel supportive sad crying funeral,sad
trying feel discouraged im starting higher weight dont want focus,angry
trying discourage also feel honored,angry
trying distance sad feelings push emotions aside im trying distract feeling needy missing like mad ive distancing pushing away,sad
trying encourage active decision amongst feel need rock faithful,angry
use limitations pain magnified begin feel angry,angry
angry feel ashamed,angry
glad built courage trick figure get right path feeling like need everything alone,angry
happy anc feeling might training next transfer hopefully sweet sister hedelius manti ut,happy
happy today everything favour today feeling rather blessed,happy
feel privileged said privileged,neutral
visualizing lots energy happy lots direction focus imagining thriving counseling business helping lots people feeling useful helpful world,happy
wearing feeling confident,neutral
wearing either outfits happy camper feel cute look cute feel like,happy
feel content want life,happy
depends time space define control reality source much joy positivity also feels threatened virtually times therefore attempts hold state perpetual seeking,happy
willing yet feels like even depressed,sad
writing sharing much story believe heart world needs know riches god feeling angry towards trying bash people leaders parents,angry
writing addy gets chance somebodys momma feels discouraged hold write message baby,angry
yelling kids drop hat reason possess energy anything feeling irritable sad everything,sad
friend sometime feel insulted around,neutral
expert feeling rushed anxious getting worked frustrated feel overwhelmed job,neutral
analyzed many number endowments investment linked plans feel contented,happy
one great books prompt mixed feelings love amongst melancholy hate amongst admiration even possible,sad
answered feeling rather skeptical,neutral
appreciate award feel many wonderful blogs winners,neutral
array began feel frightened nerves sadly shaken,sad
arrived apollo victoria saturday performance couldnt help feeling excited well sad,sad
arrived gym ball sunshine made feel welcomed gym although felt like dorky unfit rotund sloth fit environment buffed fit looking fierce looking bloke,neutral
arrived home feeling knackered confused happy thinking best date ever,happy
arrived talking feel discouraged,angry
ask joy feel sorrowful,happy
ask shed like says doesnt mind always making suggestions feel like im try every day keep entertained,neutral
